No.     Time           Source                Destination           Protocol Length Info
     67 25.416324      192.168.90.57         192.168.1.201         TCP      66     1966 → 4370 [SYN] Seq=0 Win=64240 Len=0 MSS=1460 WS=256 SACK_PERM=1

Frame 67: 66 bytes on wire (528 bits), 66 bytes captured (528 bits) on interface 0
Ethernet II, Src: IntelCor_dc:cc:f6 (64:80:99:dc:cc:f6), Dst: e6:8d:8c:d8:dc:0c (e6:8d:8c:d8:dc:0c)
    Destination: e6:8d:8c:d8:dc:0c (e6:8d:8c:d8:dc:0c)
        Address: e6:8d:8c:d8:dc:0c (e6:8d:8c:d8:dc:0c)
        .... ..1. .... .... .... .... = LG bit: Locally administered address (this is NOT the factory default)
        .... ...0 .... .... .... .... = IG bit: Individual address (unicast)
    Source: IntelCor_dc:cc:f6 (64:80:99:dc:cc:f6)
        Address: IntelCor_dc:cc:f6 (64:80:99:dc:cc:f6)
        .... ..0. .... .... .... .... = LG bit: Globally unique address (factory default)
        .... ...0 .... .... .... .... = IG bit: Individual address (unicast)
    Type: IPv4 (0x0800)
Internet Protocol Version 4, Src: 192.168.90.57, Dst: 192.168.1.201
    0100 .... = Version: 4
    .... 0101 = Header Length: 20 bytes (5)
    Differentiated Services Field: 0x00 (DSCP: CS0, ECN: Not-ECT)
    Total Length: 52
    Identification: 0x038a (906)
    Flags: 0x02 (Don't Fragment)
    Fragment offset: 0
    Time to live: 128
    Protocol: TCP (6)
    Header checksum: 0x19e7 [validation disabled]
    [Header checksum status: Unverified]
    Source: 192.168.90.57
    Destination: 192.168.1.201
    [Source GeoIP: Unknown]
    [Destination GeoIP: Unknown]
Transmission Control Protocol, Src Port: 1966, Dst Port: 4370, Seq: 0, Len: 0
    Source Port: 1966
    Destination Port: 4370
    [Stream index: 1]
    [TCP Segment Len: 0]
    Sequence number: 0    (relative sequence number)
    Acknowledgment number: 0
    1000 .... = Header Length: 32 bytes (8)
    Flags: 0x002 (SYN)
    Window size value: 64240
    [Calculated window size: 64240]
    Checksum: 0x8c3a [unverified]
    [Checksum Status: Unverified]
    Urgent pointer: 0
    Options: (12 bytes), Maximum segment size, No-Operation (NOP), Window scale, No-Operation (NOP), No-Operation (NOP), SACK permitted
        TCP Option - Maximum segment size: 1460 bytes
            Kind: Maximum Segment Size (2)
            Length: 4
            MSS Value: 1460
        TCP Option - No-Operation (NOP)
            Kind: No-Operation (1)
        TCP Option - Window scale: 8 (multiply by 256)
            Kind: Window Scale (3)
            Length: 3
            Shift count: 8
            [Multiplier: 256]
        TCP Option - No-Operation (NOP)
            Kind: No-Operation (1)
        TCP Option - No-Operation (NOP)
            Kind: No-Operation (1)
        TCP Option - SACK permitted
            Kind: SACK Permitted (4)
            Length: 2

No.     Time           Source                Destination           Protocol Length Info
     68 25.418237      192.168.1.201         192.168.90.57         TCP      66     4370 → 1966 [SYN, ACK] Seq=0 Ack=1 Win=5840 Len=0 MSS=1460 SACK_PERM=1 WS=2

Frame 68: 66 bytes on wire (528 bits), 66 bytes captured (528 bits) on interface 0
Ethernet II, Src: e6:8d:8c:d8:dc:0c (e6:8d:8c:d8:dc:0c), Dst: IntelCor_dc:cc:f6 (64:80:99:dc:cc:f6)
    Destination: IntelCor_dc:cc:f6 (64:80:99:dc:cc:f6)
        Address: IntelCor_dc:cc:f6 (64:80:99:dc:cc:f6)
        .... ..0. .... .... .... .... = LG bit: Globally unique address (factory default)
        .... ...0 .... .... .... .... = IG bit: Individual address (unicast)
    Source: e6:8d:8c:d8:dc:0c (e6:8d:8c:d8:dc:0c)
        Address: e6:8d:8c:d8:dc:0c (e6:8d:8c:d8:dc:0c)
        .... ..1. .... .... .... .... = LG bit: Locally administered address (this is NOT the factory default)
        .... ...0 .... .... .... .... = IG bit: Individual address (unicast)
    Type: IPv4 (0x0800)
Internet Protocol Version 4, Src: 192.168.1.201, Dst: 192.168.90.57
    0100 .... = Version: 4
    .... 0101 = Header Length: 20 bytes (5)
    Differentiated Services Field: 0x00 (DSCP: CS0, ECN: Not-ECT)
    Total Length: 52
    Identification: 0x0000 (0)
    Flags: 0x02 (Don't Fragment)
    Fragment offset: 0
    Time to live: 63
    Protocol: TCP (6)
    Header checksum: 0x5e71 [validation disabled]
    [Header checksum status: Unverified]
    Source: 192.168.1.201
    Destination: 192.168.90.57
    [Source GeoIP: Unknown]
    [Destination GeoIP: Unknown]
Transmission Control Protocol, Src Port: 4370, Dst Port: 1966, Seq: 0, Ack: 1, Len: 0
    Source Port: 4370
    Destination Port: 1966
    [Stream index: 1]
    [TCP Segment Len: 0]
    Sequence number: 0    (relative sequence number)
    Acknowledgment number: 1    (relative ack number)
    1000 .... = Header Length: 32 bytes (8)
    Flags: 0x012 (SYN, ACK)
    Window size value: 5840
    [Calculated window size: 5840]
    Checksum: 0x96c5 [unverified]
    [Checksum Status: Unverified]
    Urgent pointer: 0
    Options: (12 bytes), Maximum segment size, No-Operation (NOP), No-Operation (NOP), SACK permitted, No-Operation (NOP), Window scale
        TCP Option - Maximum segment size: 1460 bytes
            Kind: Maximum Segment Size (2)
            Length: 4
            MSS Value: 1460
        TCP Option - No-Operation (NOP)
            Kind: No-Operation (1)
        TCP Option - No-Operation (NOP)
            Kind: No-Operation (1)
        TCP Option - SACK permitted
            Kind: SACK Permitted (4)
            Length: 2
        TCP Option - No-Operation (NOP)
            Kind: No-Operation (1)
        TCP Option - Window scale: 1 (multiply by 2)
            Kind: Window Scale (3)
            Length: 3
            Shift count: 1
            [Multiplier: 2]
    [SEQ/ACK analysis]

No.     Time           Source                Destination           Protocol Length Info
     69 25.418320      192.168.90.57         192.168.1.201         TCP      54     1966 → 4370 [ACK] Seq=1 Ack=1 Win=65536 Len=0

Frame 69: 54 bytes on wire (432 bits), 54 bytes captured (432 bits) on interface 0
Ethernet II, Src: IntelCor_dc:cc:f6 (64:80:99:dc:cc:f6), Dst: e6:8d:8c:d8:dc:0c (e6:8d:8c:d8:dc:0c)
    Destination: e6:8d:8c:d8:dc:0c (e6:8d:8c:d8:dc:0c)
        Address: e6:8d:8c:d8:dc:0c (e6:8d:8c:d8:dc:0c)
        .... ..1. .... .... .... .... = LG bit: Locally administered address (this is NOT the factory default)
        .... ...0 .... .... .... .... = IG bit: Individual address (unicast)
    Source: IntelCor_dc:cc:f6 (64:80:99:dc:cc:f6)
        Address: IntelCor_dc:cc:f6 (64:80:99:dc:cc:f6)
        .... ..0. .... .... .... .... = LG bit: Globally unique address (factory default)
        .... ...0 .... .... .... .... = IG bit: Individual address (unicast)
    Type: IPv4 (0x0800)
Internet Protocol Version 4, Src: 192.168.90.57, Dst: 192.168.1.201
    0100 .... = Version: 4
    .... 0101 = Header Length: 20 bytes (5)
    Differentiated Services Field: 0x00 (DSCP: CS0, ECN: Not-ECT)
    Total Length: 40
    Identification: 0x038b (907)
    Flags: 0x02 (Don't Fragment)
    Fragment offset: 0
    Time to live: 128
    Protocol: TCP (6)
    Header checksum: 0x19f2 [validation disabled]
    [Header checksum status: Unverified]
    Source: 192.168.90.57
    Destination: 192.168.1.201
    [Source GeoIP: Unknown]
    [Destination GeoIP: Unknown]
Transmission Control Protocol, Src Port: 1966, Dst Port: 4370, Seq: 1, Ack: 1, Len: 0
    Source Port: 1966
    Destination Port: 4370
    [Stream index: 1]
    [TCP Segment Len: 0]
    Sequence number: 1    (relative sequence number)
    Acknowledgment number: 1    (relative ack number)
    0101 .... = Header Length: 20 bytes (5)
    Flags: 0x010 (ACK)
    Window size value: 256
    [Calculated window size: 65536]
    [Window size scaling factor: 256]
    Checksum: 0xed61 [unverified]
    [Checksum Status: Unverified]
    Urgent pointer: 0
    [SEQ/ACK analysis]

No.     Time           Source                Destination           Protocol Length Info
     70 25.418344      192.168.90.57         192.168.1.201         TCP      54     [TCP Window Update] 1966 → 4370 [ACK] Seq=1 Ack=1 Win=262144 Len=0

Frame 70: 54 bytes on wire (432 bits), 54 bytes captured (432 bits) on interface 0
Ethernet II, Src: IntelCor_dc:cc:f6 (64:80:99:dc:cc:f6), Dst: e6:8d:8c:d8:dc:0c (e6:8d:8c:d8:dc:0c)
    Destination: e6:8d:8c:d8:dc:0c (e6:8d:8c:d8:dc:0c)
        Address: e6:8d:8c:d8:dc:0c (e6:8d:8c:d8:dc:0c)
        .... ..1. .... .... .... .... = LG bit: Locally administered address (this is NOT the factory default)
        .... ...0 .... .... .... .... = IG bit: Individual address (unicast)
    Source: IntelCor_dc:cc:f6 (64:80:99:dc:cc:f6)
        Address: IntelCor_dc:cc:f6 (64:80:99:dc:cc:f6)
        .... ..0. .... .... .... .... = LG bit: Globally unique address (factory default)
        .... ...0 .... .... .... .... = IG bit: Individual address (unicast)
    Type: IPv4 (0x0800)
Internet Protocol Version 4, Src: 192.168.90.57, Dst: 192.168.1.201
    0100 .... = Version: 4
    .... 0101 = Header Length: 20 bytes (5)
    Differentiated Services Field: 0x00 (DSCP: CS0, ECN: Not-ECT)
    Total Length: 40
    Identification: 0x038c (908)
    Flags: 0x02 (Don't Fragment)
    Fragment offset: 0
    Time to live: 128
    Protocol: TCP (6)
    Header checksum: 0x19f1 [validation disabled]
    [Header checksum status: Unverified]
    Source: 192.168.90.57
    Destination: 192.168.1.201
    [Source GeoIP: Unknown]
    [Destination GeoIP: Unknown]
Transmission Control Protocol, Src Port: 1966, Dst Port: 4370, Seq: 1, Ack: 1, Len: 0
    Source Port: 1966
    Destination Port: 4370
    [Stream index: 1]
    [TCP Segment Len: 0]
    Sequence number: 1    (relative sequence number)
    Acknowledgment number: 1    (relative ack number)
    0101 .... = Header Length: 20 bytes (5)
    Flags: 0x010 (ACK)
    Window size value: 1024
    [Calculated window size: 262144]
    [Window size scaling factor: 256]
    Checksum: 0xea61 [unverified]
    [Checksum Status: Unverified]
    Urgent pointer: 0
    [SEQ/ACK analysis]

No.     Time           Source                Destination           Protocol Length Info
     71 25.418607      192.168.90.57         192.168.1.201         TCP      71     1966 → 4370 [PSH, ACK] Seq=1 Ack=1 Win=262144 Len=17

Frame 71: 71 bytes on wire (568 bits), 71 bytes captured (568 bits) on interface 0
Ethernet II, Src: IntelCor_dc:cc:f6 (64:80:99:dc:cc:f6), Dst: e6:8d:8c:d8:dc:0c (e6:8d:8c:d8:dc:0c)
    Destination: e6:8d:8c:d8:dc:0c (e6:8d:8c:d8:dc:0c)
        Address: e6:8d:8c:d8:dc:0c (e6:8d:8c:d8:dc:0c)
        .... ..1. .... .... .... .... = LG bit: Locally administered address (this is NOT the factory default)
        .... ...0 .... .... .... .... = IG bit: Individual address (unicast)
    Source: IntelCor_dc:cc:f6 (64:80:99:dc:cc:f6)
        Address: IntelCor_dc:cc:f6 (64:80:99:dc:cc:f6)
        .... ..0. .... .... .... .... = LG bit: Globally unique address (factory default)
        .... ...0 .... .... .... .... = IG bit: Individual address (unicast)
    Type: IPv4 (0x0800)
Internet Protocol Version 4, Src: 192.168.90.57, Dst: 192.168.1.201
    0100 .... = Version: 4
    .... 0101 = Header Length: 20 bytes (5)
    Differentiated Services Field: 0x00 (DSCP: CS0, ECN: Not-ECT)
    Total Length: 57
    Identification: 0x038d (909)
    Flags: 0x02 (Don't Fragment)
    Fragment offset: 0
    Time to live: 128
    Protocol: TCP (6)
    Header checksum: 0x19df [validation disabled]
    [Header checksum status: Unverified]
    Source: 192.168.90.57
    Destination: 192.168.1.201
    [Source GeoIP: Unknown]
    [Destination GeoIP: Unknown]
Transmission Control Protocol, Src Port: 1966, Dst Port: 4370, Seq: 1, Ack: 1, Len: 17
    Source Port: 1966
    Destination Port: 4370
    [Stream index: 1]
    [TCP Segment Len: 17]
    Sequence number: 1    (relative sequence number)
    [Next sequence number: 18    (relative sequence number)]
    Acknowledgment number: 1    (relative ack number)
    0101 .... = Header Length: 20 bytes (5)
    Flags: 0x018 (PSH, ACK)
    Window size value: 1024
    [Calculated window size: 262144]
    [Window size scaling factor: 256]
    Checksum: 0xad0c [unverified]
    [Checksum Status: Unverified]
    Urgent pointer: 0
    [SEQ/ACK analysis]
    TCP payload (17 bytes)
Data (17 bytes)

0000  aa 01 76 09 00 00 00 00 00 61 64 6d 69 6e f9 f3   ..v......admin..
0010  55                                                U
    Data: aa017609000000000061646d696ef9f355
    [Length: 17]

No.     Time           Source                Destination           Protocol Length Info
     72 25.419966      192.168.1.201         192.168.90.57         TCP      54     4370 → 1966 [ACK] Seq=1 Ack=18 Win=5840 Len=0

Frame 72: 54 bytes on wire (432 bits), 54 bytes captured (432 bits) on interface 0
Ethernet II, Src: e6:8d:8c:d8:dc:0c (e6:8d:8c:d8:dc:0c), Dst: IntelCor_dc:cc:f6 (64:80:99:dc:cc:f6)
    Destination: IntelCor_dc:cc:f6 (64:80:99:dc:cc:f6)
        Address: IntelCor_dc:cc:f6 (64:80:99:dc:cc:f6)
        .... ..0. .... .... .... .... = LG bit: Globally unique address (factory default)
        .... ...0 .... .... .... .... = IG bit: Individual address (unicast)
    Source: e6:8d:8c:d8:dc:0c (e6:8d:8c:d8:dc:0c)
        Address: e6:8d:8c:d8:dc:0c (e6:8d:8c:d8:dc:0c)
        .... ..1. .... .... .... .... = LG bit: Locally administered address (this is NOT the factory default)
        .... ...0 .... .... .... .... = IG bit: Individual address (unicast)
    Type: IPv4 (0x0800)
Internet Protocol Version 4, Src: 192.168.1.201, Dst: 192.168.90.57
    0100 .... = Version: 4
    .... 0101 = Header Length: 20 bytes (5)
    Differentiated Services Field: 0x00 (DSCP: CS0, ECN: Not-ECT)
    Total Length: 40
    Identification: 0x46e0 (18144)
    Flags: 0x02 (Don't Fragment)
    Fragment offset: 0
    Time to live: 63
    Protocol: TCP (6)
    Header checksum: 0x179d [validation disabled]
    [Header checksum status: Unverified]
    Source: 192.168.1.201
    Destination: 192.168.90.57
    [Source GeoIP: Unknown]
    [Destination GeoIP: Unknown]
Transmission Control Protocol, Src Port: 4370, Dst Port: 1966, Seq: 1, Ack: 18, Len: 0
    Source Port: 4370
    Destination Port: 1966
    [Stream index: 1]
    [TCP Segment Len: 0]
    Sequence number: 1    (relative sequence number)
    Acknowledgment number: 18    (relative ack number)
    0101 .... = Header Length: 20 bytes (5)
    Flags: 0x010 (ACK)
    Window size value: 2920
    [Calculated window size: 5840]
    [Window size scaling factor: 2]
    Checksum: 0xe2e8 [unverified]
    [Checksum Status: Unverified]
    Urgent pointer: 0
    [SEQ/ACK analysis]

No.     Time           Source                Destination           Protocol Length Info
     73 25.425243      192.168.1.201         192.168.90.57         TCP      66     4370 → 1966 [PSH, ACK] Seq=1 Ack=18 Win=5840 Len=12

Frame 73: 66 bytes on wire (528 bits), 66 bytes captured (528 bits) on interface 0
Ethernet II, Src: e6:8d:8c:d8:dc:0c (e6:8d:8c:d8:dc:0c), Dst: IntelCor_dc:cc:f6 (64:80:99:dc:cc:f6)
    Destination: IntelCor_dc:cc:f6 (64:80:99:dc:cc:f6)
        Address: IntelCor_dc:cc:f6 (64:80:99:dc:cc:f6)
        .... ..0. .... .... .... .... = LG bit: Globally unique address (factory default)
        .... ...0 .... .... .... .... = IG bit: Individual address (unicast)
    Source: e6:8d:8c:d8:dc:0c (e6:8d:8c:d8:dc:0c)
        Address: e6:8d:8c:d8:dc:0c (e6:8d:8c:d8:dc:0c)
        .... ..1. .... .... .... .... = LG bit: Locally administered address (this is NOT the factory default)
        .... ...0 .... .... .... .... = IG bit: Individual address (unicast)
    Type: IPv4 (0x0800)
Internet Protocol Version 4, Src: 192.168.1.201, Dst: 192.168.90.57
    0100 .... = Version: 4
    .... 0101 = Header Length: 20 bytes (5)
    Differentiated Services Field: 0x00 (DSCP: CS0, ECN: Not-ECT)
    Total Length: 52
    Identification: 0x46e1 (18145)
    Flags: 0x02 (Don't Fragment)
    Fragment offset: 0
    Time to live: 63
    Protocol: TCP (6)
    Header checksum: 0x1790 [validation disabled]
    [Header checksum status: Unverified]
    Source: 192.168.1.201
    Destination: 192.168.90.57
    [Source GeoIP: Unknown]
    [Destination GeoIP: Unknown]
Transmission Control Protocol, Src Port: 4370, Dst Port: 1966, Seq: 1, Ack: 18, Len: 12
    Source Port: 4370
    Destination Port: 1966
    [Stream index: 1]
    [TCP Segment Len: 12]
    Sequence number: 1    (relative sequence number)
    [Next sequence number: 13    (relative sequence number)]
    Acknowledgment number: 18    (relative ack number)
    0101 .... = Header Length: 20 bytes (5)
    Flags: 0x018 (PSH, ACK)
    Window size value: 2920
    [Calculated window size: 5840]
    [Window size scaling factor: 2]
    Checksum: 0xe7f2 [unverified]
    [Checksum Status: Unverified]
    Urgent pointer: 0
    [SEQ/ACK analysis]
    TCP payload (12 bytes)
Data (12 bytes)

0000  aa 00 c8 04 00 18 4a 00 00 6f 3e 55               ......J..o>U
    Data: aa00c80400184a00006f3e55
    [Length: 12]

No.     Time           Source                Destination           Protocol Length Info
     74 25.465853      192.168.90.57         192.168.1.201         TCP      54     1966 → 4370 [ACK] Seq=18 Ack=13 Win=261888 Len=0

Frame 74: 54 bytes on wire (432 bits), 54 bytes captured (432 bits) on interface 0
Ethernet II, Src: IntelCor_dc:cc:f6 (64:80:99:dc:cc:f6), Dst: e6:8d:8c:d8:dc:0c (e6:8d:8c:d8:dc:0c)
    Destination: e6:8d:8c:d8:dc:0c (e6:8d:8c:d8:dc:0c)
        Address: e6:8d:8c:d8:dc:0c (e6:8d:8c:d8:dc:0c)
        .... ..1. .... .... .... .... = LG bit: Locally administered address (this is NOT the factory default)
        .... ...0 .... .... .... .... = IG bit: Individual address (unicast)
    Source: IntelCor_dc:cc:f6 (64:80:99:dc:cc:f6)
        Address: IntelCor_dc:cc:f6 (64:80:99:dc:cc:f6)
        .... ..0. .... .... .... .... = LG bit: Globally unique address (factory default)
        .... ...0 .... .... .... .... = IG bit: Individual address (unicast)
    Type: IPv4 (0x0800)
Internet Protocol Version 4, Src: 192.168.90.57, Dst: 192.168.1.201
    0100 .... = Version: 4
    .... 0101 = Header Length: 20 bytes (5)
    Differentiated Services Field: 0x00 (DSCP: CS0, ECN: Not-ECT)
    Total Length: 40
    Identification: 0x038e (910)
    Flags: 0x02 (Don't Fragment)
    Fragment offset: 0
    Time to live: 128
    Protocol: TCP (6)
    Header checksum: 0x19ef [validation disabled]
    [Header checksum status: Unverified]
    Source: 192.168.90.57
    Destination: 192.168.1.201
    [Source GeoIP: Unknown]
    [Destination GeoIP: Unknown]
Transmission Control Protocol, Src Port: 1966, Dst Port: 4370, Seq: 18, Ack: 13, Len: 0
    Source Port: 1966
    Destination Port: 4370
    [Stream index: 1]
    [TCP Segment Len: 0]
    Sequence number: 18    (relative sequence number)
    Acknowledgment number: 13    (relative ack number)
    0101 .... = Header Length: 20 bytes (5)
    Flags: 0x010 (ACK)
    Window size value: 1023
    [Calculated window size: 261888]
    [Window size scaling factor: 256]
    Checksum: 0xea45 [unverified]
    [Checksum Status: Unverified]
    Urgent pointer: 0
    [SEQ/ACK analysis]

No.     Time           Source                Destination           Protocol Length Info
     75 25.550628      192.168.90.57         192.168.1.201         TCP      66     1966 → 4370 [PSH, ACK] Seq=18 Ack=13 Win=261888 Len=12

Frame 75: 66 bytes on wire (528 bits), 66 bytes captured (528 bits) on interface 0
Ethernet II, Src: IntelCor_dc:cc:f6 (64:80:99:dc:cc:f6), Dst: e6:8d:8c:d8:dc:0c (e6:8d:8c:d8:dc:0c)
    Destination: e6:8d:8c:d8:dc:0c (e6:8d:8c:d8:dc:0c)
        Address: e6:8d:8c:d8:dc:0c (e6:8d:8c:d8:dc:0c)
        .... ..1. .... .... .... .... = LG bit: Locally administered address (this is NOT the factory default)
        .... ...0 .... .... .... .... = IG bit: Individual address (unicast)
    Source: IntelCor_dc:cc:f6 (64:80:99:dc:cc:f6)
        Address: IntelCor_dc:cc:f6 (64:80:99:dc:cc:f6)
        .... ..0. .... .... .... .... = LG bit: Globally unique address (factory default)
        .... ...0 .... .... .... .... = IG bit: Individual address (unicast)
    Type: IPv4 (0x0800)
Internet Protocol Version 4, Src: 192.168.90.57, Dst: 192.168.1.201
    0100 .... = Version: 4
    .... 0101 = Header Length: 20 bytes (5)
    Differentiated Services Field: 0x00 (DSCP: CS0, ECN: Not-ECT)
    Total Length: 52
    Identification: 0x038f (911)
    Flags: 0x02 (Don't Fragment)
    Fragment offset: 0
    Time to live: 128
    Protocol: TCP (6)
    Header checksum: 0x19e2 [validation disabled]
    [Header checksum status: Unverified]
    Source: 192.168.90.57
    Destination: 192.168.1.201
    [Source GeoIP: Unknown]
    [Destination GeoIP: Unknown]
Transmission Control Protocol, Src Port: 1966, Dst Port: 4370, Seq: 18, Ack: 13, Len: 12
    Source Port: 1966
    Destination Port: 4370
    [Stream index: 1]
    [TCP Segment Len: 12]
    Sequence number: 18    (relative sequence number)
    [Next sequence number: 30    (relative sequence number)]
    Acknowledgment number: 13    (relative ack number)
    0101 .... = Header Length: 20 bytes (5)
    Flags: 0x018 (PSH, ACK)
    Window size value: 1023
    [Calculated window size: 261888]
    [Window size scaling factor: 256]
    Checksum: 0x413d [unverified]
    [Checksum Status: Unverified]
    Urgent pointer: 0
    [SEQ/ACK analysis]
    TCP payload (12 bytes)
Data (12 bytes)

0000  aa 01 06 04 00 18 4a 01 00 80 ae 55               ......J....U
    Data: aa01060400184a010080ae55
    [Length: 12]

No.     Time           Source                Destination           Protocol Length Info
     76 25.590257      192.168.1.201         192.168.90.57         TCP      54     4370 → 1966 [ACK] Seq=13 Ack=30 Win=5840 Len=0

Frame 76: 54 bytes on wire (432 bits), 54 bytes captured (432 bits) on interface 0
Ethernet II, Src: e6:8d:8c:d8:dc:0c (e6:8d:8c:d8:dc:0c), Dst: IntelCor_dc:cc:f6 (64:80:99:dc:cc:f6)
    Destination: IntelCor_dc:cc:f6 (64:80:99:dc:cc:f6)
        Address: IntelCor_dc:cc:f6 (64:80:99:dc:cc:f6)
        .... ..0. .... .... .... .... = LG bit: Globally unique address (factory default)
        .... ...0 .... .... .... .... = IG bit: Individual address (unicast)
    Source: e6:8d:8c:d8:dc:0c (e6:8d:8c:d8:dc:0c)
        Address: e6:8d:8c:d8:dc:0c (e6:8d:8c:d8:dc:0c)
        .... ..1. .... .... .... .... = LG bit: Locally administered address (this is NOT the factory default)
        .... ...0 .... .... .... .... = IG bit: Individual address (unicast)
    Type: IPv4 (0x0800)
Internet Protocol Version 4, Src: 192.168.1.201, Dst: 192.168.90.57
    0100 .... = Version: 4
    .... 0101 = Header Length: 20 bytes (5)
    Differentiated Services Field: 0x00 (DSCP: CS0, ECN: Not-ECT)
    Total Length: 40
    Identification: 0x46e2 (18146)
    Flags: 0x02 (Don't Fragment)
    Fragment offset: 0
    Time to live: 63
    Protocol: TCP (6)
    Header checksum: 0x179b [validation disabled]
    [Header checksum status: Unverified]
    Source: 192.168.1.201
    Destination: 192.168.90.57
    [Source GeoIP: Unknown]
    [Destination GeoIP: Unknown]
Transmission Control Protocol, Src Port: 4370, Dst Port: 1966, Seq: 13, Ack: 30, Len: 0
    Source Port: 4370
    Destination Port: 1966
    [Stream index: 1]
    [TCP Segment Len: 0]
    Sequence number: 13    (relative sequence number)
    Acknowledgment number: 30    (relative ack number)
    0101 .... = Header Length: 20 bytes (5)
    Flags: 0x010 (ACK)
    Window size value: 2920
    [Calculated window size: 5840]
    [Window size scaling factor: 2]
    Checksum: 0xe2d0 [unverified]
    [Checksum Status: Unverified]
    Urgent pointer: 0
    [SEQ/ACK analysis]

No.     Time           Source                Destination           Protocol Length Info
     77 25.619683      192.168.1.201         192.168.90.57         TCP      1242   4370 → 1966 [PSH, ACK] Seq=13 Ack=30 Win=5840 Len=1188

Frame 77: 1242 bytes on wire (9936 bits), 1242 bytes captured (9936 bits) on interface 0
Ethernet II, Src: e6:8d:8c:d8:dc:0c (e6:8d:8c:d8:dc:0c), Dst: IntelCor_dc:cc:f6 (64:80:99:dc:cc:f6)
    Destination: IntelCor_dc:cc:f6 (64:80:99:dc:cc:f6)
        Address: IntelCor_dc:cc:f6 (64:80:99:dc:cc:f6)
        .... ..0. .... .... .... .... = LG bit: Globally unique address (factory default)
        .... ...0 .... .... .... .... = IG bit: Individual address (unicast)
    Source: e6:8d:8c:d8:dc:0c (e6:8d:8c:d8:dc:0c)
        Address: e6:8d:8c:d8:dc:0c (e6:8d:8c:d8:dc:0c)
        .... ..1. .... .... .... .... = LG bit: Locally administered address (this is NOT the factory default)
        .... ...0 .... .... .... .... = IG bit: Individual address (unicast)
    Type: IPv4 (0x0800)
Internet Protocol Version 4, Src: 192.168.1.201, Dst: 192.168.90.57
    0100 .... = Version: 4
    .... 0101 = Header Length: 20 bytes (5)
    Differentiated Services Field: 0x00 (DSCP: CS0, ECN: Not-ECT)
    Total Length: 1228
    Identification: 0x46e3 (18147)
    Flags: 0x02 (Don't Fragment)
    Fragment offset: 0
    Time to live: 63
    Protocol: TCP (6)
    Header checksum: 0x12f6 [validation disabled]
    [Header checksum status: Unverified]
    Source: 192.168.1.201
    Destination: 192.168.90.57
    [Source GeoIP: Unknown]
    [Destination GeoIP: Unknown]
Transmission Control Protocol, Src Port: 4370, Dst Port: 1966, Seq: 13, Ack: 30, Len: 1188
    Source Port: 4370
    Destination Port: 1966
    [Stream index: 1]
    [TCP Segment Len: 1188]
    Sequence number: 13    (relative sequence number)
    [Next sequence number: 1201    (relative sequence number)]
    Acknowledgment number: 30    (relative ack number)
    0101 .... = Header Length: 20 bytes (5)
    Flags: 0x018 (PSH, ACK)
    Window size value: 2920
    [Calculated window size: 5840]
    [Window size scaling factor: 2]
    Checksum: 0x76a3 [unverified]
    [Checksum Status: Unverified]
    Urgent pointer: 0
    [SEQ/ACK analysis]
    TCP payload (1188 bytes)
Data (1188 bytes)

0000  aa 00 c8 9c 04 18 4a 01 00 75 73 65 72 3d 31 2c   ......J..user=1,
0010  55 49 44 3d 69 31 2c 43 61 72 64 4e 6f 3d 69 32   UID=i1,CardNo=i2
0020  2c 50 69 6e 3d 69 33 2c 50 61 73 73 77 6f 72 64   ,Pin=i3,Password
0030  3d 73 34 2c 47 72 6f 75 70 3d 69 35 2c 53 74 61   =s4,Group=i5,Sta
0040  72 74 54 69 6d 65 3d 69 36 2c 45 6e 64 54 69 6d   rtTime=i6,EndTim
0050  65 3d 69 37 2c 4e 61 6d 65 3d 73 38 2c 50 72 69   e=i7,Name=s8,Pri
0060  76 69 6c 65 67 65 3d 69 39 2c 53 75 70 65 72 41   vilege=i9,SuperA
0070  75 74 68 6f 72 69 7a 65 3d 69 31 30 0a 75 73 65   uthorize=i10.use
0080  72 61 75 74 68 6f 72 69 7a 65 3d 32 2c 50 69 6e   rauthorize=2,Pin
0090  3d 69 31 2c 41 75 74 68 6f 72 69 7a 65 54 69 6d   =i1,AuthorizeTim
00a0  65 7a 6f 6e 65 49 64 3d 69 32 2c 41 75 74 68 6f   ezoneId=i2,Autho
00b0  72 69 7a 65 44 6f 6f 72 49 64 3d 69 33 0a 68 6f   rizeDoorId=i3.ho
00c0  6c 69 64 61 79 3d 33 2c 48 6f 6c 69 64 61 79 3d   liday=3,Holiday=
00d0  69 31 2c 48 6f 6c 69 64 61 79 54 79 70 65 3d 69   i1,HolidayType=i
00e0  32 2c 4c 6f 6f 70 3d 69 33 0a 74 69 6d 65 7a 6f   2,Loop=i3.timezo
00f0  6e 65 3d 34 2c 54 69 6d 65 7a 6f 6e 65 49 64 3d   ne=4,TimezoneId=
0100  69 31 2c 53 75 6e 54 69 6d 65 31 3d 69 32 2c 53   i1,SunTime1=i2,S
0110  75 6e 54 69 6d 65 32 3d 69 33 2c 53 75 6e 54 69   unTime2=i3,SunTi
0120  6d 65 33 3d 69 34 2c 4d 6f 6e 54 69 6d 65 31 3d   me3=i4,MonTime1=
0130  69 35 2c 4d 6f 6e 54 69 6d 65 32 3d 69 36 2c 4d   i5,MonTime2=i6,M
0140  6f 6e 54 69 6d 65 33 3d 69 37 2c 54 75 65 54 69   onTime3=i7,TueTi
0150  6d 65 31 3d 69 38 2c 54 75 65 54 69 6d 65 32 3d   me1=i8,TueTime2=
0160  69 39 2c 54 75 65 54 69 6d 65 33 3d 69 31 30 2c   i9,TueTime3=i10,
0170  57 65 64 54 69 6d 65 31 3d 69 31 31 2c 57 65 64   WedTime1=i11,Wed
0180  54 69 6d 65 32 3d 69 31 32 2c 57 65 64 54 69 6d   Time2=i12,WedTim
0190  65 33 3d 69 31 33 2c 54 68 75 54 69 6d 65 31 3d   e3=i13,ThuTime1=
01a0  69 31 34 2c 54 68 75 54 69 6d 65 32 3d 69 31 35   i14,ThuTime2=i15
01b0  2c 54 68 75 54 69 6d 65 33 3d 69 31 36 2c 46 72   ,ThuTime3=i16,Fr
01c0  69 54 69 6d 65 31 3d 69 31 37 2c 46 72 69 54 69   iTime1=i17,FriTi
01d0  6d 65 32 3d 69 31 38 2c 46 72 69 54 69 6d 65 33   me2=i18,FriTime3
01e0  3d 69 31 39 2c 53 61 74 54 69 6d 65 31 3d 69 32   =i19,SatTime1=i2
01f0  30 2c 53 61 74 54 69 6d 65 32 3d 69 32 31 2c 53   0,SatTime2=i21,S
0200  61 74 54 69 6d 65 33 3d 69 32 32 2c 48 6f 6c 31   atTime3=i22,Hol1
0210  54 69 6d 65 31 3d 69 32 33 2c 48 6f 6c 31 54 69   Time1=i23,Hol1Ti
0220  6d 65 32 3d 69 32 34 2c 48 6f 6c 31 54 69 6d 65   me2=i24,Hol1Time
0230  33 3d 69 32 35 2c 48 6f 6c 32 54 69 6d 65 31 3d   3=i25,Hol2Time1=
0240  69 32 36 2c 48 6f 6c 32 54 69 6d 65 32 3d 69 32   i26,Hol2Time2=i2
0250  37 2c 48 6f 6c 32 54 69 6d 65 33 3d 69 32 38 2c   7,Hol2Time3=i28,
0260  48 6f 6c 33 54 69 6d 65 31 3d 69 32 39 2c 48 6f   Hol3Time1=i29,Ho
0270  6c 33 54 69 6d 65 32 3d 69 33 30 2c 48 6f 6c 33   l3Time2=i30,Hol3
0280  54 69 6d 65 33 3d 69 33 31 0a 74 72 61 6e 73 61   Time3=i31.transa
0290  63 74 69 6f 6e 3d 35 2c 43 61 72 64 6e 6f 3d 69   ction=5,Cardno=i
02a0  31 2c 50 69 6e 3d 69 32 2c 56 65 72 69 66 69 65   1,Pin=i2,Verifie
02b0  64 3d 69 33 2c 44 6f 6f 72 49 44 3d 69 34 2c 45   d=i3,DoorID=i4,E
02c0  76 65 6e 74 54 79 70 65 3d 69 35 2c 49 6e 4f 75   ventType=i5,InOu
02d0  74 53 74 61 74 65 3d 69 36 2c 54 69 6d 65 5f 73   tState=i6,Time_s
02e0  65 63 6f 6e 64 3d 69 37 0a 66 69 72 73 74 63 61   econd=i7.firstca
02f0  72 64 3d 36 2c 50 69 6e 3d 69 31 2c 44 6f 6f 72   rd=6,Pin=i1,Door
0300  49 44 3d 69 32 2c 54 69 6d 65 7a 6f 6e 65 49 44   ID=i2,TimezoneID
0310  3d 69 33 0a 6d 75 6c 74 69 6d 63 61 72 64 3d 37   =i3.multimcard=7
0320  2c 49 6e 64 65 78 3d 69 31 2c 44 6f 6f 72 49 64   ,Index=i1,DoorId
0330  3d 69 32 2c 47 72 6f 75 70 31 3d 69 33 2c 47 72   =i2,Group1=i3,Gr
0340  6f 75 70 32 3d 69 34 2c 47 72 6f 75 70 33 3d 69   oup2=i4,Group3=i
0350  35 2c 47 72 6f 75 70 34 3d 69 36 2c 47 72 6f 75   5,Group4=i6,Grou
0360  70 35 3d 69 37 0a 69 6e 6f 75 74 66 75 6e 3d 38   p5=i7.inoutfun=8
0370  2c 49 6e 64 65 78 3d 69 31 2c 45 76 65 6e 74 54   ,Index=i1,EventT
0380  79 70 65 3d 69 32 2c 49 6e 41 64 64 72 3d 69 33   ype=i2,InAddr=i3
0390  2c 4f 75 74 54 79 70 65 3d 69 34 2c 4f 75 74 41   ,OutType=i4,OutA
03a0  64 64 72 3d 69 35 2c 4f 75 74 54 69 6d 65 3d 69   ddr=i5,OutTime=i
03b0  36 2c 52 65 73 65 72 76 65 64 3d 69 37 0a 74 65   6,Reserved=i7.te
03c0  6d 70 6c 61 74 65 3d 39 2c 53 69 7a 65 3d 69 31   mplate=9,Size=i1
03d0  2c 50 69 6e 3d 69 32 2c 46 69 6e 67 65 72 49 44   ,Pin=i2,FingerID
03e0  3d 69 33 2c 56 61 6c 69 64 3d 69 34 2c 54 65 6d   =i3,Valid=i4,Tem
03f0  70 6c 61 74 65 3d 73 35 0a 74 65 6d 70 6c 61 74   plate=s5.templat
0400  65 76 31 30 3d 31 30 2c 53 69 7a 65 3d 69 31 2c   ev10=10,Size=i1,
0410  55 49 44 3d 69 32 2c 50 69 6e 3d 69 33 2c 46 69   UID=i2,Pin=i3,Fi
0420  6e 67 65 72 49 44 3d 69 34 2c 56 61 6c 69 64 3d   ngerID=i4,Valid=
0430  69 35 2c 54 65 6d 70 6c 61 74 65 3d 42 36 2c 52   i5,Template=B6,R
0440  65 73 76 65 72 64 3d 69 37 2c 45 6e 64 54 61 67   esverd=i7,EndTag
0450  3d 69 38 0a 6f 70 6c 6f 67 3d 31 31 2c 41 64 6d   =i8.oplog=11,Adm
0460  69 6e 3d 69 31 2c 4f 50 3d 69 32 2c 74 69 6d 65   in=i1,OP=i2,time
0470  3d 69 33 2c 4f 62 6a 73 31 3d 69 34 2c 4f 62 6a   =i3,Objs1=i4,Obj
0480  73 32 3d 69 35 2c 4f 62 6a 73 33 3d 69 36 2c 4f   s2=i5,Objs3=i6,O
0490  62 6a 73 34 3d 69 37 2c 4f 62 6a 73 35 3d 69 38   bjs4=i7,Objs5=i8
04a0  0a 55 a7 55                                       .U.U
    Data: aa00c89c04184a0100757365723d312c5549443d69312c43...
    [Length: 1188]

No.     Time           Source                Destination           Protocol Length Info
     78 25.628415      192.168.90.57         192.168.1.201         TCP      66     1966 → 4370 [PSH, ACK] Seq=30 Ack=1201 Win=260864 Len=12

Frame 78: 66 bytes on wire (528 bits), 66 bytes captured (528 bits) on interface 0
Ethernet II, Src: IntelCor_dc:cc:f6 (64:80:99:dc:cc:f6), Dst: e6:8d:8c:d8:dc:0c (e6:8d:8c:d8:dc:0c)
    Destination: e6:8d:8c:d8:dc:0c (e6:8d:8c:d8:dc:0c)
        Address: e6:8d:8c:d8:dc:0c (e6:8d:8c:d8:dc:0c)
        .... ..1. .... .... .... .... = LG bit: Locally administered address (this is NOT the factory default)
        .... ...0 .... .... .... .... = IG bit: Individual address (unicast)
    Source: IntelCor_dc:cc:f6 (64:80:99:dc:cc:f6)
        Address: IntelCor_dc:cc:f6 (64:80:99:dc:cc:f6)
        .... ..0. .... .... .... .... = LG bit: Globally unique address (factory default)
        .... ...0 .... .... .... .... = IG bit: Individual address (unicast)
    Type: IPv4 (0x0800)
Internet Protocol Version 4, Src: 192.168.90.57, Dst: 192.168.1.201
    0100 .... = Version: 4
    .... 0101 = Header Length: 20 bytes (5)
    Differentiated Services Field: 0x00 (DSCP: CS0, ECN: Not-ECT)
    Total Length: 52
    Identification: 0x0390 (912)
    Flags: 0x02 (Don't Fragment)
    Fragment offset: 0
    Time to live: 128
    Protocol: TCP (6)
    Header checksum: 0x19e1 [validation disabled]
    [Header checksum status: Unverified]
    Source: 192.168.90.57
    Destination: 192.168.1.201
    [Source GeoIP: Unknown]
    [Destination GeoIP: Unknown]
Transmission Control Protocol, Src Port: 1966, Dst Port: 4370, Seq: 30, Ack: 1201, Len: 12
    Source Port: 1966
    Destination Port: 4370
    [Stream index: 1]
    [TCP Segment Len: 12]
    Sequence number: 30    (relative sequence number)
    [Next sequence number: 42    (relative sequence number)]
    Acknowledgment number: 1201    (relative ack number)
    0101 .... = Header Length: 20 bytes (5)
    Flags: 0x018 (PSH, ACK)
    Window size value: 1019
    [Calculated window size: 260864]
    [Window size scaling factor: 256]
    Checksum: 0x47b4 [unverified]
    [Checksum Status: Unverified]
    Urgent pointer: 0
    [SEQ/ACK analysis]
    TCP payload (12 bytes)
Data (12 bytes)

0000  aa 01 0b 04 00 18 4a 02 00 5c 9e 55               ......J..\.U
    Data: aa010b0400184a02005c9e55
    [Length: 12]

No.     Time           Source                Destination           Protocol Length Info
     79 25.630338      192.168.1.201         192.168.90.57         TCP      54     4370 → 1966 [ACK] Seq=1201 Ack=42 Win=5840 Len=0

Frame 79: 54 bytes on wire (432 bits), 54 bytes captured (432 bits) on interface 0
Ethernet II, Src: e6:8d:8c:d8:dc:0c (e6:8d:8c:d8:dc:0c), Dst: IntelCor_dc:cc:f6 (64:80:99:dc:cc:f6)
    Destination: IntelCor_dc:cc:f6 (64:80:99:dc:cc:f6)
        Address: IntelCor_dc:cc:f6 (64:80:99:dc:cc:f6)
        .... ..0. .... .... .... .... = LG bit: Globally unique address (factory default)
        .... ...0 .... .... .... .... = IG bit: Individual address (unicast)
    Source: e6:8d:8c:d8:dc:0c (e6:8d:8c:d8:dc:0c)
        Address: e6:8d:8c:d8:dc:0c (e6:8d:8c:d8:dc:0c)
        .... ..1. .... .... .... .... = LG bit: Locally administered address (this is NOT the factory default)
        .... ...0 .... .... .... .... = IG bit: Individual address (unicast)
    Type: IPv4 (0x0800)
Internet Protocol Version 4, Src: 192.168.1.201, Dst: 192.168.90.57
    0100 .... = Version: 4
    .... 0101 = Header Length: 20 bytes (5)
    Differentiated Services Field: 0x00 (DSCP: CS0, ECN: Not-ECT)
    Total Length: 40
    Identification: 0x46e4 (18148)
    Flags: 0x02 (Don't Fragment)
    Fragment offset: 0
    Time to live: 63
    Protocol: TCP (6)
    Header checksum: 0x1799 [validation disabled]
    [Header checksum status: Unverified]
    Source: 192.168.1.201
    Destination: 192.168.90.57
    [Source GeoIP: Unknown]
    [Destination GeoIP: Unknown]
Transmission Control Protocol, Src Port: 4370, Dst Port: 1966, Seq: 1201, Ack: 42, Len: 0
    Source Port: 4370
    Destination Port: 1966
    [Stream index: 1]
    [TCP Segment Len: 0]
    Sequence number: 1201    (relative sequence number)
    Acknowledgment number: 42    (relative ack number)
    0101 .... = Header Length: 20 bytes (5)
    Flags: 0x010 (ACK)
    Window size value: 2920
    [Calculated window size: 5840]
    [Window size scaling factor: 2]
    Checksum: 0xde20 [unverified]
    [Checksum Status: Unverified]
    Urgent pointer: 0
    [SEQ/ACK analysis]

No.     Time           Source                Destination           Protocol Length Info
     80 25.642218      192.168.1.201         192.168.90.57         TCP      82     4370 → 1966 [PSH, ACK] Seq=1201 Ack=42 Win=5840 Len=28

Frame 80: 82 bytes on wire (656 bits), 82 bytes captured (656 bits) on interface 0
Ethernet II, Src: e6:8d:8c:d8:dc:0c (e6:8d:8c:d8:dc:0c), Dst: IntelCor_dc:cc:f6 (64:80:99:dc:cc:f6)
    Destination: IntelCor_dc:cc:f6 (64:80:99:dc:cc:f6)
        Address: IntelCor_dc:cc:f6 (64:80:99:dc:cc:f6)
        .... ..0. .... .... .... .... = LG bit: Globally unique address (factory default)
        .... ...0 .... .... .... .... = IG bit: Individual address (unicast)
    Source: e6:8d:8c:d8:dc:0c (e6:8d:8c:d8:dc:0c)
        Address: e6:8d:8c:d8:dc:0c (e6:8d:8c:d8:dc:0c)
        .... ..1. .... .... .... .... = LG bit: Locally administered address (this is NOT the factory default)
        .... ...0 .... .... .... .... = IG bit: Individual address (unicast)
    Type: IPv4 (0x0800)
Internet Protocol Version 4, Src: 192.168.1.201, Dst: 192.168.90.57
    0100 .... = Version: 4
    .... 0101 = Header Length: 20 bytes (5)
    Differentiated Services Field: 0x00 (DSCP: CS0, ECN: Not-ECT)
    Total Length: 68
    Identification: 0x46e5 (18149)
    Flags: 0x02 (Don't Fragment)
    Fragment offset: 0
    Time to live: 63
    Protocol: TCP (6)
    Header checksum: 0x177c [validation disabled]
    [Header checksum status: Unverified]
    Source: 192.168.1.201
    Destination: 192.168.90.57
    [Source GeoIP: Unknown]
    [Destination GeoIP: Unknown]
Transmission Control Protocol, Src Port: 4370, Dst Port: 1966, Seq: 1201, Ack: 42, Len: 28
    Source Port: 4370
    Destination Port: 1966
    [Stream index: 1]
    [TCP Segment Len: 28]
    Sequence number: 1201    (relative sequence number)
    [Next sequence number: 1229    (relative sequence number)]
    Acknowledgment number: 42    (relative ack number)
    0101 .... = Header Length: 20 bytes (5)
    Flags: 0x018 (PSH, ACK)
    Window size value: 2920
    [Calculated window size: 5840]
    [Window size scaling factor: 2]
    Checksum: 0x9a91 [unverified]
    [Checksum Status: Unverified]
    Urgent pointer: 0
    [SEQ/ACK analysis]
    TCP payload (28 bytes)
Data (28 bytes)

0000  aa 00 c8 14 00 18 4a 02 00 00 00 00 00 00 00 00   ......J.........
0010  00 c8 00 ff 00 98 80 e7 22 9f e1 55               ........"..U
    Data: aa00c81400184a02000000000000000000c800ff009880e7...
    [Length: 28]

No.     Time           Source                Destination           Protocol Length Info
     81 25.682524      192.168.90.57         192.168.1.201         TCP      54     1966 → 4370 [ACK] Seq=42 Ack=1229 Win=260864 Len=0

Frame 81: 54 bytes on wire (432 bits), 54 bytes captured (432 bits) on interface 0
Ethernet II, Src: IntelCor_dc:cc:f6 (64:80:99:dc:cc:f6), Dst: e6:8d:8c:d8:dc:0c (e6:8d:8c:d8:dc:0c)
    Destination: e6:8d:8c:d8:dc:0c (e6:8d:8c:d8:dc:0c)
        Address: e6:8d:8c:d8:dc:0c (e6:8d:8c:d8:dc:0c)
        .... ..1. .... .... .... .... = LG bit: Locally administered address (this is NOT the factory default)
